{
 "id": "tt-2022-12-13",
 "title": "Monthly State Retail Sales",
 "hook": "Please add alt text (alternative text) to all of your posted graphics for #TidyTuesday. Twitter provides guidelines for how to add alt text to your images. The DataViz Society/Nightingale by way of Amy Cesal has an article on writing good alt text for plots/graphs. Here's a simple formula for writing alt text for data visualization: ### Chart type It's helpful for people with partial sight to know what chart type it is and gives context for understanding the rest of the visual. Example: Line graph ### Type of data What data is included in the chart? The x and y axis labels may help you figure this out. Example: number of bananas sold per day in the last year ### Reason for including the chart Think about why you're including this visual. What does it show that's meaningful. There should be a point to every visual and you should tell people what to look for.",
 "questions": [],
 "subjects": [
  "economy & work"
 ],
 "provider_type": "government",
 "geography": "United States",
 "sources": [
  {
   "name": "US Census Bureau Monthly State Retails Sales",
   "url": "https://www.census.gov/retail/state_retail_sales.html"
  }
 ],
 "articles": [
  {
   "name": "Interactive Visualization from US Census Bureau",
   "url": "https://www.census.gov/retail/state_retail_sales.html"
  }
 ],
 "tables": [
  {
   "file": "state_retail.csv",
   "bytes": 1460534,
   "url": "https://raw.githubusercontent.com/rfordatascience/tidytuesday/main/data/2022/2022-12-13/state_retail.csv",
   "columns": [
    "fips",
    "state_abbr",
    "naics",
    "subsector",
    "year",
    "month",
    "change_yoy",
    "change_yoy_se",
    "coverage_code"
   ]
  },
  {
   "file": "coverage_codes.csv",
   "bytes": 408,
   "url": "https://raw.githubusercontent.com/rfordatascience/tidytuesday/main/data/2022/2022-12-13/coverage_codes.csv",
   "columns": [
    "coverage_code",
    "coverage"
   ]
  }
 ],
 "extra_files": 0,
 "found_in": [
  {
   "aggregation": "tidytuesday",
   "date": "2022-12-13",
   "year": 2022,
   "week": 50,
   "url": "https://github.com/rfordatascience/tidytuesday/tree/main/data/2022/2022-12-13"
  }
 ],
 "added": "2026-09-06",
 "provider": {
  "name": "ACS",
  "host": "census.gov"
 }
}
