{
 "id": "tt-2018-05-29",
 "title": "Comic book characters",
 "hook": "",
 "questions": [],
 "subjects": [
  "books & language"
 ],
 "provider_type": "journalism",
 "geography": "",
 "sources": [
  {
   "name": "FiveThirtyEight package",
   "url": "https://github.com/rudeboybert/fivethirtyeight"
  }
 ],
 "articles": [
  {
   "name": "FiveThirtyEight.com",
   "url": "https://fivethirtyeight.com/features/women-in-comic-books/"
  }
 ],
 "tables": [
  {
   "file": "week9_comic_characters.csv",
   "bytes": 4858319,
   "url": "https://raw.githubusercontent.com/rfordatascience/tidytuesday/main/data/2018/2018-05-29/week9_comic_characters.csv",
   "columns": []
  }
 ],
 "extra_files": 0,
 "found_in": [
  {
   "aggregation": "tidytuesday",
   "date": "2018-05-29",
   "year": 2018,
   "week": 9,
   "url": "https://github.com/rfordatascience/tidytuesday/tree/main/data/2018/2018-05-29"
  }
 ],
 "added": "2026-09-06",
 "provider": {
  "name": "FiveThirtyEight",
  "host": "fivethirtyeight"
 }
}
