{
 "id": "tt-2023-06-20",
 "title": "UFO Sightings Redux",
 "hook": "The data this week comes from the National UFO Reporting Center, cleaned and enriched with data from sunrise-sunset.org by Jon Harmon. If this dataset looks familiar, that's because we used a version of it back in 2019. The new version adds the last several years of data, adds information about time-of-day, and cleans up some errors in the original dataset. We'd love to see visualizations describing the differences between the 2019 dataset and this new dataset! See Jon Harmon's cleaning and enriching scripts for most of the (extensive) cleaning.",
 "questions": [],
 "subjects": [
  "oddities & curiosities"
 ],
 "provider_type": "nonprofit or society",
 "geography": "United States",
 "sources": [
  {
   "name": "National UFO Reporting Center",
   "url": "https://nuforc.org/webreports/ndxshape.html"
  },
  {
   "name": "sunrise-sunset.org",
   "url": "https://sunrise-sunset.org"
  }
 ],
 "articles": [
  {
   "name": "TidyTuesday 2019-06-25",
   "url": "https://tidytues.day/2019/2019-06-25"
  }
 ],
 "tables": [
  {
   "file": "ufo_sightings.csv",
   "bytes": 18261421,
   "url": "https://raw.githubusercontent.com/rfordatascience/tidytuesday/main/data/2023/2023-06-20/ufo_sightings.csv",
   "columns": [
    "reported_date_time",
    "reported_date_time_utc",
    "posted_date",
    "city",
    "state",
    "country_code",
    "shape",
    "reported_duration",
    "duration_seconds",
    "summary",
    "has_images",
    "day_part"
   ]
  },
  {
   "file": "places.csv",
   "bytes": 2924768,
   "url": "https://raw.githubusercontent.com/rfordatascience/tidytuesday/main/data/2023/2023-06-20/places.csv",
   "columns": [
    "city",
    "alternate_city_names",
    "state",
    "country",
    "country_code",
    "latitude",
    "longitude",
    "timezone",
    "population",
    "elevation_m"
   ]
  },
  {
   "file": "day_parts_map.csv",
   "bytes": 2612556,
   "url": "https://raw.githubusercontent.com/rfordatascience/tidytuesday/main/data/2023/2023-06-20/day_parts_map.csv",
   "columns": [
    "rounded_lat",
    "rounded_long",
    "rounded_date",
    "astronomical_twilight_begin",
    "nautical_twilight_begin",
    "civil_twilight_begin",
    "sunrise",
    "solar_noon",
    "sunset",
    "civil_twilight_end",
    "nautical_twilight_end",
    "astronomical_twilight_end"
   ]
  }
 ],
 "extra_files": 0,
 "found_in": [
  {
   "aggregation": "tidytuesday",
   "date": "2023-06-20",
   "year": 2023,
   "week": 25,
   "url": "https://github.com/rfordatascience/tidytuesday/tree/main/data/2023/2023-06-20"
  }
 ],
 "added": "2026-09-06",
 "provider": {
  "name": "NUFORC",
  "host": "nuforc.org"
 }
}
