{
 "id": "tt-2021-07-20",
 "title": "US Droughts",
 "hook": "The data this week comes from the U.S. Drought Monitor. Many more datasets including county-level data can be accessed there. In the interest of size we stuck with state-level data. This dataset was covered by the NY Times and CNN. The dataset for today ranges from 2001 to 2021, but again more data is available at the Drought Monitor. Drought classification can be found on the US Drought Monitor site. Please reference the data as seen below: The U.S. Drought Monitor is jointly produced by the National Drought Mitigation Center at the University of Nebraska-Lincoln, the United States Department of Agriculture, and the National Oceanic and Atmospheric Administration. Map courtesy of NDMC. Some maps and other interesting summaries can be found on the Drought Monitor site and their Map Collection. Some limitations of the data expanded on the Drought Monitor site.",
 "questions": [],
 "subjects": [
  "environment & climate"
 ],
 "provider_type": "academic",
 "geography": "United States",
 "sources": [
  {
   "name": "Drought Monitor",
   "url": "https://droughtmonitor.unl.edu/DmData/DataDownload.aspx"
  }
 ],
 "articles": [
  {
   "name": "NYTimes",
   "url": "https://www.nytimes.com/interactive/2021/06/11/climate/california-western-drought-map.html"
  },
  {
   "name": "CNN",
   "url": "https://www.cnn.com/2021/06/17/weather/west-california-drought-maps/index.html"
  }
 ],
 "tables": [
  {
   "file": "drought.csv",
   "bytes": 19133449,
   "url": "https://raw.githubusercontent.com/rfordatascience/tidytuesday/main/data/2021/2021-07-20/drought.csv",
   "columns": [
    "map_date",
    "state_abb",
    "valid_start",
    "valid_end",
    "stat_fmt",
    "drought_lvl",
    "area_pct",
    "area_total",
    "pop_pct",
    "pop_total"
   ]
  }
 ],
 "extra_files": 4,
 "found_in": [
  {
   "aggregation": "tidytuesday",
   "date": "2021-07-20",
   "year": 2021,
   "week": 30,
   "url": "https://github.com/rfordatascience/tidytuesday/tree/main/data/2021/2021-07-20"
  }
 ],
 "added": "2026-09-06",
 "provider": {
  "name": "Drought Monitor",
  "host": "droughtmonitor.unl.edu"
 }
}
