{
 "id": "tt-2019-11-19",
 "title": "NZ Bird of the Year",
 "hook": "This week's data is from the New Zealand Forest and Bird Orginization courtesy of Dragonfly Data Science by way of Nathan Moore. Full details around voting can be found at the Bird of the Year site. I have uploaded the raw data and the clean data, was a quick dplyr::pivotlonger() call! Full details around voting are below - please note that votes are ranked 1-5 (1 is best, 5 is worst), and the voters do not need to submit all 5 votes. This year, voting is based on the instant runoff (IRV) voting system, which is similar to the system you might have seen in local elections. When you vote, you can rank up to five of your favourite birds, with #1 indicating your favourite bird, #2 indicating your second favourite bird, and so on. It's no problem if you want to vote for less than five birds.",
 "questions": [],
 "subjects": [
  "animals & nature"
 ],
 "provider_type": "nonprofit or society",
 "geography": "",
 "sources": [
  {
   "name": "New Zealand Forest and Bird Org",
   "url": "https://www.forestandbird.org.nz/"
  }
 ],
 "articles": [
  {
   "name": "Dragonfly Data Science",
   "url": "https://www.dragonfly.co.nz/news/2019-11-12-boty.html"
  },
  {
   "name": "Nathan Moore",
   "url": "https://twitter.com/nmoorenz"
  }
 ],
 "tables": [
  {
   "file": "nz_bird.csv",
   "bytes": 7387622,
   "url": "https://raw.githubusercontent.com/rfordatascience/tidytuesday/main/data/2019/2019-11-19/nz_bird.csv",
   "columns": []
  }
 ],
 "extra_files": 1,
 "found_in": [
  {
   "aggregation": "tidytuesday",
   "date": "2019-11-19",
   "year": 2019,
   "week": 47,
   "url": "https://github.com/rfordatascience/tidytuesday/tree/main/data/2019/2019-11-19"
  }
 ],
 "added": "2026-09-06",
 "provider": {
  "name": "New Zealand Forest and Bird Org",
  "host": "forestandbird.org.nz"
 }
}
