{
 "id": "tt-2019-12-17",
 "title": "Adoptable dogs",
 "hook": "This week's data is from The Pudding. The data was cleaned, collected and story written by Amber Thomas, with design by Sacha Maxim. Their article Finding Forever Homes examines data on all adoptable dogs from Petfinder.com in the USA on 2019-09-20. There are a number of datasets, where the dogtravel and dogdescriptions datasets can be joined via the common id column. The premise of the story in Amber's own words: \"If you're looking to add a new furry friend to your family, you may be encouraged to \"adopt not shop\". That is, to find a new dog at a local shelter or rescue organization rather than a pet store or breeder.",
 "questions": [],
 "subjects": [
  "animals & nature"
 ],
 "provider_type": "platform",
 "geography": "United States",
 "sources": [
  {
   "name": "Petfinder",
   "url": "https://github.com/the-pudding/data/blob/master/dog-shelters/README.md"
  }
 ],
 "articles": [
  {
   "name": "The Pudding",
   "url": "https://pudding.cool/2019/10/shelters/"
  }
 ],
 "tables": [
  {
   "file": "dog_moves.csv",
   "bytes": 2196,
   "url": "https://raw.githubusercontent.com/rfordatascience/tidytuesday/main/data/2019/2019-12-17/dog_moves.csv",
   "columns": [
    "location",
    "exported",
    "imported",
    "total",
    "inUS"
   ]
  },
  {
   "file": "dog_travel.csv",
   "bytes": 12057182,
   "url": "https://raw.githubusercontent.com/rfordatascience/tidytuesday/main/data/2019/2019-12-17/dog_travel.csv",
   "columns": [
    "id",
    "contact_city",
    "contact_state",
    "description",
    "found",
    "manual",
    "remove",
    "still_there"
   ]
  },
  {
   "file": "dog_descriptions.csv",
   "bytes": 67934276,
   "url": "https://raw.githubusercontent.com/rfordatascience/tidytuesday/main/data/2019/2019-12-17/dog_descriptions.csv",
   "columns": [
    "id",
    "org_id",
    "url",
    "species",
    "breed_primary",
    "breed_secondary",
    "breed_mixed",
    "breed_unknown",
    "color_primary",
    "color_secondary",
    "color_tertiary",
    "age",
    "sex",
    "size",
    "coat",
    "fixed",
    "house_trained",
    "declawed",
    "special_needs",
    "shots_current",
    "env_children",
    "env_dogs",
    "env_cats",
    "tags",
    "photo",
    "status",
    "posted",
    "contact_city",
    "contact_state",
    "contact_zip",
    "contact_country",
    "stateQ",
    "accessed",
    "type",
    "description"
   ]
  }
 ],
 "extra_files": 0,
 "found_in": [
  {
   "aggregation": "tidytuesday",
   "date": "2019-12-17",
   "year": 2019,
   "week": 51,
   "url": "https://github.com/rfordatascience/tidytuesday/tree/main/data/2019/2019-12-17"
  }
 ],
 "added": "2026-09-06",
 "provider": {
  "name": "Petfinder",
  "host": "petfinder"
 }
}
