{
 "id": "tt-2021-01-26",
 "title": "Plastic Pollution",
 "hook": "The data this week comes from Break Free from Plastic courtesy of [Sarah Sauve]( Sarah put together a nice Blogpost on her approach to this data, which includes cleaning the data and a Shiny app! I found out about Break Free From Plastic's Brand Audits through my involvement with the local Social Justice Cooperative of Newfoundland and Labrador's Zero Waste Action Team. One of my colleagues and friends proposed an audit in St. John's, partially to contribute to the global audit and as part of a bigger project to understand the sources of plastic in our city. We completed our audit in October 2020 and are the first submission to BFFP from Newfoundland! You can find our data presented in this Shiny dashboard.",
 "questions": [],
 "subjects": [
  "environment & climate"
 ],
 "provider_type": "nonprofit or society",
 "geography": "global",
 "sources": [
  {
   "name": "Break Free from Plastic",
   "url": "https://www.breakfreefromplastic.org"
  }
 ],
 "articles": [
  {
   "name": "Sarah Sauve",
   "url": "https://github.com/sarahsauve/TidyTuesdays/blob/master/BFFPDashboard/BlogPost.md"
  }
 ],
 "tables": [
  {
   "file": "plastics.csv",
   "bytes": 742005,
   "url": "https://raw.githubusercontent.com/rfordatascience/tidytuesday/main/data/2021/2021-01-26/plastics.csv",
   "columns": [
    "country",
    "year",
    "parent_company",
    "empty",
    "hdpe",
    "ldpe",
    "o",
    "pet",
    "pp",
    "ps",
    "pvc",
    "grand_total",
    "num_events",
    "volunteers"
   ]
  }
 ],
 "extra_files": 2,
 "found_in": [
  {
   "aggregation": "tidytuesday",
   "date": "2021-01-26",
   "year": 2021,
   "week": 5,
   "url": "https://github.com/rfordatascience/tidytuesday/tree/main/data/2021/2021-01-26"
  }
 ],
 "added": "2026-09-06",
 "provider": {
  "name": "Break Free from Plastic",
  "host": "breakfreefromplastic.org"
 }
}
