{
 "id": "tt-2022-06-28",
 "title": "UK Gender pay gap",
 "hook": "The data this week comes from gender-pay-gap.service.gov.uk. The online tool reports by gender and occupation. The online quiz lets you test your knowledge/guesses.",
 "questions": [],
 "subjects": [
  "economy & work",
  "society & demographics"
 ],
 "provider_type": "government",
 "geography": "United Kingdom",
 "sources": [
  {
   "name": "gender-pay-gap.service.gov.uk",
   "url": "https://gender-pay-gap.service.gov.uk/"
  }
 ],
 "articles": [
  {
   "name": "ons.gov.uk",
   "url": "https://www.ons.gov.uk/employmentandlabourmarket/peopleinwork/earningsandworkinghours/articles/findoutthegenderpaygapforyourjob/2016-12-09"
  }
 ],
 "tables": [
  {
   "file": "paygap.csv",
   "bytes": 16781778,
   "url": "https://raw.githubusercontent.com/rfordatascience/tidytuesday/main/data/2022/2022-06-28/paygap.csv",
   "columns": [
    "**Field**",
    "EmployerName",
    "EmployerID",
    "Address",
    "PostCode",
    "CompanyNumber",
    "SicCodes",
    "DiffMeanHourlyPercent",
    "DiffMedianHourlyPercent",
    "DiffMeanBonusPercent",
    "DiffMedianBonusPercent",
    "MaleBonusPercent",
    "FemaleBonusPercent",
    "MaleLowerQuartile",
    "FemaleLowerQuartile",
    "MaleLowerMiddleQuartile",
    "FemaleLowerMiddleQuartile",
    "MaleUpperMiddleQuartile",
    "FemaleUpperMiddleQuartile",
    "MaleTopQuartile",
    "FemaleTopQuartile",
    "CompanyLinkToGPGInfo",
    "ResponsiblePerson",
    "EmployerSize",
    "CurrentName",
    "SubmittedAfterTheDeadline",
    "DueDate",
    "DateSubmitted"
   ]
  }
 ],
 "extra_files": 7,
 "found_in": [
  {
   "aggregation": "tidytuesday",
   "date": "2022-06-28",
   "year": 2022,
   "week": 26,
   "url": "https://github.com/rfordatascience/tidytuesday/tree/main/data/2022/2022-06-28"
  }
 ],
 "added": "2026-09-06",
 "provider": {
  "name": "gender-pay-gap.service.gov.uk",
  "host": "gender-pay-gap.service.gov.uk"
 }
}
