{
 "id": "tt-2023-03-21",
 "title": "Programming Languages",
 "hook": "Please add alt text (alternative text) to all of your posted graphics for #TidyTuesday. Twitter provides guidelines for how to add alt text to your images. The DataViz Society/Nightingale by way of Amy Cesal has an article on writing good alt text for plots/graphs. Here's a simple formula for writing alt text for data visualization: ### Chart type It's helpful for people with partial sight to know what chart type it is and gives context for understanding the rest of the visual. Example: Line graph ### Type of data What data is included in the chart? The x and y axis labels may help you figure this out. Example: number of bananas sold per day in the last year ### Reason for including the chart Think about why you're including this visual. What does it show that's meaningful. There should be a point to every visual and you should tell people what to look for.",
 "questions": [],
 "subjects": [
  "books & language"
 ],
 "provider_type": "company",
 "geography": "",
 "sources": [
  {
   "name": "Programming Language DataBase",
   "url": "https://pldb.com/index.html"
  }
 ],
 "articles": [
  {
   "name": "Does every programming language have line comments?",
   "url": "https://pldb.com/posts/does-every-programming-language-support-line-comments.html"
  }
 ],
 "tables": [
  {
   "file": "languages.csv",
   "bytes": 2618104,
   "url": "https://raw.githubusercontent.com/rfordatascience/tidytuesday/main/data/2023/2023-03-21/languages.csv",
   "columns": [
    "pldb_id",
    "title",
    "description",
    "type",
    "appeared",
    "creators",
    "website",
    "domain_name",
    "domain_name_registered",
    "reference",
    "isbndb",
    "book_count",
    "semantic_scholar",
    "language_rank",
    "github_repo",
    "github_repo_stars",
    "github_repo_forks",
    "github_repo_updated",
    "github_repo_subscribers",
    "github_repo_created",
    "github_repo_description",
    "github_repo_issues",
    "github_repo_first_commit",
    "github_language",
    "github_language_tm_scope",
    "github_language_type",
    "github_language_ace_mode",
    "github_language_file_extensions",
    "github_language_repos",
    "wikipedia",
    "wikipedia_daily_page_views",
    "wikipedia_backlinks_count",
    "wikipedia_summary",
    "wikipedia_page_id",
    "wikipedia_appeared",
    "wikipedia_created",
    "wikipedia_revision_count",
    "wikipedia_related",
    "features_has_comments",
    "features_has_semantic_indentation",
    "features_has_line_comments",
    "line_comment_token",
    "last_activity",
    "number_of_users",
    "number_of_jobs",
    "origin_community",
    "central_package_repository_count",
    "file_type",
    "is_open_source"
   ]
  }
 ],
 "extra_files": 0,
 "found_in": [
  {
   "aggregation": "tidytuesday",
   "date": "2023-03-21",
   "year": 2023,
   "week": 12,
   "url": "https://github.com/rfordatascience/tidytuesday/tree/main/data/2023/2023-03-21"
  }
 ],
 "added": "2026-09-06",
 "provider": {
  "name": "Programming Language DataBase",
  "host": "pldb.com"
 }
}
