{
 "id": "tt-2022-09-20",
 "title": "Hydro Wastewater plants",
 "hook": "Please add alt text (alternative text) to all of your posted graphics for #TidyTuesday. Twitter provides guidelines for how to add alt text to your images. The DataViz Society/Nightingale by way of Amy Cesal has an article on writing good alt text for plots/graphs. Here's a simple formula for writing alt text for data visualization: ### Chart type It's helpful for people with partial sight to know what chart type it is and gives context for understanding the rest of the visual. Example: Line graph ### Type of data What data is included in the chart? The x and y axis labels may help you figure this out. Example: number of bananas sold per day in the last year ### Reason for including the chart Think about why you're including this visual. What does it show that's meaningful. There should be a point to every visual and you should tell people what to look for.",
 "questions": [],
 "subjects": [
  "environment & climate",
  "transport & infrastructure"
 ],
 "provider_type": "academic",
 "geography": "",
 "sources": [
  {
   "name": "Macedo et al, 2022",
   "url": "https://essd.copernicus.org/articles/14/559/2022/#section4"
  }
 ],
 "articles": [
  {
   "name": "HydroWASTE v1.0",
   "url": "https://figshare.com/articles/dataset/HydroWASTE_version_1_0/14847786/1"
  }
 ],
 "tables": [
  {
   "file": "HydroWASTE_v10.csv",
   "bytes": 8810554,
   "url": "https://raw.githubusercontent.com/rfordatascience/tidytuesday/main/data/2022/2022-09-20/HydroWASTE_v10.csv",
   "columns": [
    "col",
    "WASTE_ID",
    "SOURCE",
    "ORG_ID",
    "WWTP_NAME",
    "COUNTRY",
    "CNTRY_ISO",
    "LAT_WWTP",
    "LON_WWTP",
    "QUAL_LOC",
    "LAT_OUT",
    "LON_OUT",
    "STATUS",
    "POP_SERVED",
    "QUAL_POP",
    "WASTE_DIS",
    "QUAL_WASTE",
    "LEVEL",
    "QUAL_LEVEL",
    "DF",
    "HYRIV_ID",
    "RIVER_DIS",
    "COAST_10KM",
    "COAST_50KM",
    "DESIGN_CAP",
    "QUAL_CAP"
   ]
  }
 ],
 "extra_files": 0,
 "found_in": [
  {
   "aggregation": "tidytuesday",
   "date": "2022-09-20",
   "year": 2022,
   "week": 38,
   "url": "https://github.com/rfordatascience/tidytuesday/tree/main/data/2022/2022-09-20"
  }
 ],
 "added": "2026-09-06",
 "provider": {
  "name": "Macedo et al, 2022",
  "host": "essd.copernicus.org"
 }
}
